{
  "version": "1",
  "evidence_class": "FIXTURE",
  "adapter": "recorded-selection-exercise",
  "host": "host-neutral-fixture",
  "model": "deterministic-contract-fixture",
  "isolated_skill": "skill-ecosystem-auditor",
  "runs": [
    { "case_id": "positive-release-audit", "baseline": "full-ecosystem", "selected_skills": ["skill-ecosystem-auditor"], "activation_order": ["skill-ecosystem-auditor"] },
    { "case_id": "positive-release-audit", "baseline": "isolated-skill", "selected_skills": ["skill-ecosystem-auditor"], "activation_order": ["skill-ecosystem-auditor"] },
    { "case_id": "positive-release-audit", "baseline": "no-skill", "selected_skills": [], "activation_order": [] },
    { "case_id": "negative-test-confidence", "baseline": "full-ecosystem", "selected_skills": ["test-suite-health"], "activation_order": ["test-suite-health"] },
    { "case_id": "negative-test-confidence", "baseline": "isolated-skill", "selected_skills": [], "activation_order": [] },
    { "case_id": "negative-test-confidence", "baseline": "no-skill", "selected_skills": [], "activation_order": [] },
    { "case_id": "near-neighbor-write-skill", "baseline": "full-ecosystem", "selected_skills": ["writing-for-agents"], "activation_order": ["writing-for-agents"] },
    { "case_id": "near-neighbor-write-skill", "baseline": "isolated-skill", "selected_skills": [], "activation_order": [] },
    { "case_id": "near-neighbor-write-skill", "baseline": "no-skill", "selected_skills": [], "activation_order": [] },
    { "case_id": "paraphrase-cooperating-commands", "baseline": "full-ecosystem", "selected_skills": ["skill-ecosystem-auditor"], "activation_order": ["skill-ecosystem-auditor"] },
    { "case_id": "paraphrase-cooperating-commands", "baseline": "isolated-skill", "selected_skills": ["skill-ecosystem-auditor"], "activation_order": ["skill-ecosystem-auditor"] },
    { "case_id": "paraphrase-cooperating-commands", "baseline": "no-skill", "selected_skills": [], "activation_order": [] },
    { "case_id": "underspecified-double-activation", "baseline": "full-ecosystem", "selected_skills": ["skill-ecosystem-auditor"], "activation_order": ["skill-ecosystem-auditor"] },
    { "case_id": "underspecified-double-activation", "baseline": "isolated-skill", "selected_skills": ["skill-ecosystem-auditor"], "activation_order": ["skill-ecosystem-auditor"] },
    { "case_id": "underspecified-double-activation", "baseline": "no-skill", "selected_skills": [], "activation_order": [] },
    { "case_id": "irrelevant-ecosystem-keyword", "baseline": "full-ecosystem", "selected_skills": [], "activation_order": [] },
    { "case_id": "irrelevant-ecosystem-keyword", "baseline": "isolated-skill", "selected_skills": [], "activation_order": [] },
    { "case_id": "irrelevant-ecosystem-keyword", "baseline": "no-skill", "selected_skills": [], "activation_order": [] },
    { "case_id": "composition-audit-and-rewrite", "baseline": "full-ecosystem", "selected_skills": ["skill-ecosystem-auditor", "writing-for-agents"], "activation_order": ["skill-ecosystem-auditor", "writing-for-agents"] },
    { "case_id": "composition-audit-and-rewrite", "baseline": "isolated-skill", "selected_skills": ["skill-ecosystem-auditor"], "activation_order": ["skill-ecosystem-auditor"] },
    { "case_id": "composition-audit-and-rewrite", "baseline": "no-skill", "selected_skills": [], "activation_order": [] },
    { "case_id": "lifecycle-user-only", "baseline": "full-ecosystem", "selected_skills": ["skill-ecosystem-auditor"], "activation_order": ["skill-ecosystem-auditor"] },
    { "case_id": "lifecycle-user-only", "baseline": "isolated-skill", "selected_skills": ["skill-ecosystem-auditor"], "activation_order": ["skill-ecosystem-auditor"] },
    { "case_id": "lifecycle-user-only", "baseline": "no-skill", "selected_skills": [], "activation_order": [] },
    { "case_id": "external-cooperating-fixture", "baseline": "full-ecosystem", "selected_skills": ["skill-ecosystem-auditor"], "activation_order": ["skill-ecosystem-auditor"] },
    { "case_id": "external-cooperating-fixture", "baseline": "isolated-skill", "selected_skills": ["skill-ecosystem-auditor"], "activation_order": ["skill-ecosystem-auditor"] },
    { "case_id": "external-cooperating-fixture", "baseline": "no-skill", "selected_skills": [], "activation_order": [] }
  ]
}
